{
  "id": "freefall-throw-up",
  "title": "A ball thrown straight up",
  "topic": "freefall",
  "slug": "throw-up",
  "scenario": "A ball leaves your hand at 20 m/s straight up, from a height of 1.5 m. How high does it go, when does it land, and how fast is it moving when it hits the ground?",
  "regime": 1,
  "constants": {
    "g": -10
  },
  "initial_conditions": {
    "x0": 1.5,
    "v0": 20
  },
  "assumptions": [
    {
      "claim": "No air resistance (the ball is in free fall under gravity alone).",
      "kind": "model"
    },
    {
      "claim": "g = -10 m/s^2, a clean-arithmetic simplification of -9.81 m/s^2.",
      "kind": "model"
    },
    {
      "claim": "The ball is a point mass; its size and spin are ignored.",
      "kind": "model"
    }
  ],
  "algebra": {
    "steps": [
      {
        "label": "Assert the constant-acceleration relations",
        "latex": "v = v_0 + a t \\qquad x = x_0 + v_0 t + \\tfrac{1}{2} a t^2",
        "prose": "These are the formulas the algebra-based course memorizes. (They are quadratures — we will see them fall out of the calculus.)"
      },
      {
        "label": "Apex: the top is where velocity is zero",
        "latex": "v = 0 \\;\\implies\\; t_{\\text{apex}} = - \\frac{v_{0}}{a}",
        "prose": "Velocity is zero only for an instant — but acceleration is not. The ball is still being pulled down at g."
      },
      {
        "label": "Maximum height from the timeless equation",
        "latex": "0 = v_0^2 + 2a\\,(x - x_0) \\;\\implies\\; x_{\\max} = x_{0} - \\frac{v_{0}^{2}}{2 a}",
        "prose": "Set v = 0 in v² = v₀² + 2a(x − x₀). No time needed — this is the equation an algebra student is handed without its derivation."
      },
      {
        "label": "Time of flight: solve for when it returns to the ground",
        "latex": "x_0 + v_0 t + \\tfrac{1}{2} a t^2 = 0 \\;\\implies\\; t_{\\text{flight}} = \\frac{- v_{0} - \\sqrt{- 2 a x_{0} + v_{0}^{2}}}{a}",
        "prose": "The physical (later) root of the quadratic — the moment it lands."
      },
      {
        "label": "Impact velocity at the ground",
        "latex": "v_{\\text{impact}} = - \\sqrt{- 2 a x_{0} + v_{0}^{2}}",
        "prose": "Negative because it is moving downward at impact (up is positive)."
      }
    ],
    "result": {
      "apex_time": {
        "label": "Time to the apex",
        "unit": "s",
        "symbolic_latex": "- \\frac{v_{0}}{a}",
        "value": 2.0,
        "display": "2"
      },
      "max_height": {
        "label": "Maximum height",
        "unit": "m",
        "symbolic_latex": "x_{0} - \\frac{v_{0}^{2}}{2 a}",
        "value": 21.5,
        "display": "21.5"
      },
      "flight_time": {
        "label": "Time of flight",
        "unit": "s",
        "symbolic_latex": "\\frac{- v_{0} - \\sqrt{- 2 a x_{0} + v_{0}^{2}}}{a}",
        "value": 4.073644,
        "display": "4.074"
      },
      "impact_velocity": {
        "label": "Velocity at impact",
        "unit": "m/s",
        "symbolic_latex": "- \\sqrt{- 2 a x_{0} + v_{0}^{2}}",
        "value": -20.736441,
        "display": "-20.74"
      }
    }
  },
  "calculus": {
    "steps": [
      {
        "label": "Start from the acceleration",
        "latex": "a(t) = a",
        "prose": "Constant — the only force acting is gravity. On the stacked graph this is a flat line."
      },
      {
        "label": "Velocity is the integral of acceleration",
        "latex": "v(t) = \\int a \\, dt = v_0 + a t",
        "prose": "The constant of integration is v₀ (the velocity at t = 0). The slope of the v–t graph is a; the area under the a–t graph is the change in v."
      },
      {
        "label": "Position is the integral of velocity",
        "latex": "x(t) = \\int v \\, dt = \\int (v_0 + a t)\\, dt = x_0 + v_0 t + \\tfrac{1}{2} a t^2",
        "prose": "The constant of integration is x₀. The slope of the x–t graph is v; the area under the v–t graph is the change in x."
      },
      {
        "label": "The algebra formula has emerged",
        "latex": "\\boxed{\\,x = x_0 + v_0 t + \\tfrac{1}{2} a t^2\\,}",
        "prose": "This is exactly the formula the algebra course memorizes — here it is the integral with the integrand (a) frozen to a constant. Freeze the integrand and the integral becomes multiply-and-add. That is the algebra.",
        "emphasis": true
      }
    ]
  },
  "proof": {
    "kind": "equivalence",
    "heading": "The algebra and the calculus agree — proven, not asserted.",
    "checked_by": "sympy",
    "holds": true,
    "detail": "simplify(algebra - calculus) == 0 for each identity below",
    "checks": [
      {
        "key": "v_formula_is_integral",
        "claim": "The algebra velocity formula v = v₀ + at IS the integral ∫a dt with v(0)=v₀.",
        "holds": true,
        "tier": "structural"
      },
      {
        "key": "x_formula_is_integral",
        "claim": "The algebra position formula x = x₀ + v₀t + ½at² IS the integral ∫v dt with x(0)=x₀.",
        "holds": true,
        "tier": "structural"
      },
      {
        "key": "apex_is_v_zero",
        "claim": "Velocity really is zero at the apex time (so the apex time is correct).",
        "holds": true,
        "tier": "structural"
      },
      {
        "key": "max_height_agrees",
        "claim": "Max height from the timeless equation equals the calculus trajectory at its apex.",
        "holds": true,
        "tier": "structural"
      },
      {
        "key": "flight_time_lands",
        "claim": "At the flight time the calculus trajectory really returns to the ground (so the time is correct).",
        "holds": true,
        "tier": "structural"
      },
      {
        "key": "impact_velocity_agrees",
        "claim": "Impact velocity from the timeless equation equals the calculus velocity at landing.",
        "holds": true,
        "tier": "structural"
      }
    ]
  },
  "units_check": {
    "checked_by": "sympy",
    "holds": true
  },
  "graphs": [
    {
      "kind": "stack",
      "mode": "interactive",
      "window": "landing",
      "annotate": [
        "slope_of_x_is_v",
        "area_under_v_is_displacement",
        "a_nonzero_at_apex"
      ],
      "svg": "assets/graphs/freefall-throw-up-0.svg",
      "series": {
        "t": [
          0.0,
          0.067894069,
          0.135788138,
          0.203682207,
          0.271576276,
          0.339470345,
          0.407364414,
          0.475258482,
          0.543152551,
          0.61104662,
          0.678940689,
          0.746834758,
          0.814728827,
          0.882622896,
          0.950516965,
          1.018411034,
          1.086305103,
          1.154199172,
          1.222093241,
          1.28998731,
          1.357881378,
          1.425775447,
          1.493669516,
          1.561563585,
          1.629457654,
          1.697351723,
          1.765245792,
          1.833139861,
          1.90103393,
          1.968927999,
          2.036822068,
          2.104716137,
          2.172610206,
          2.240504274,
          2.308398343,
          2.376292412,
          2.444186481,
          2.51208055,
          2.579974619,
          2.647868688,
          2.715762757,
          2.783656826,
          2.851550895,
          2.919444964,
          2.987339033,
          3.055233101,
          3.12312717,
          3.191021239,
          3.258915308,
          3.326809377,
          3.394703446,
          3.462597515,
          3.530491584,
          3.598385653,
          3.666279722,
          3.734173791,
          3.80206786,
          3.869961929,
          3.937855997,
          4.005750066,
          4.073644135
        ],
        "x": [
          1.5,
          2.834833357,
          4.1235706679,
          5.3662119328,
          6.5627571516,
          7.7132063243,
          8.817559451,
          9.8758165164,
          10.8879775517,
          11.8540425409,
          12.7740114841,
          13.6478843812,
          14.4756612323,
          15.2573420373,
          15.9929267962,
          16.6824155091,
          17.325808176,
          17.9231047968,
          18.4743053715,
          18.9794099002,
          19.4384183764,
          19.8513308137,
          20.2181472049,
          20.53886755,
          20.8134918491,
          21.0420201021,
          21.2244523091,
          21.3607884701,
          21.4510285849,
          21.4951726538,
          21.4932206765,
          21.4451726533,
          21.3510285839,
          21.2107884709,
          21.0244523102,
          20.7920201034,
          20.5134918505,
          20.1888675516,
          19.8181472066,
          19.4013308155,
          18.9384183785,
          18.4294098953,
          17.8743053661,
          17.2731047909,
          16.6258081696,
          15.9324155128,
          15.1929268,
          14.4073420413,
          13.5756612364,
          12.6978843855,
          11.7740114886,
          10.8040425456,
          9.7879775565,
          8.7258165214,
          7.6175594403,
          6.463206313,
          5.2627571398,
          4.0162119205,
          2.7235706745,
          1.3848333637,
          6.9e-09
        ],
        "v": [
          20.0,
          19.32105931,
          18.64211862,
          17.96317793,
          17.28423724,
          16.60529655,
          15.92635586,
          15.24741518,
          14.56847449,
          13.8895338,
          13.21059311,
          12.53165242,
          11.85271173,
          11.17377104,
          10.49483035,
          9.81588966,
          9.13694897,
          8.45800828,
          7.77906759,
          7.1001269,
          6.42118622,
          5.74224553,
          5.06330484,
          4.38436415,
          3.70542346,
          3.02648277,
          2.34754208,
          1.66860139,
          0.9896607,
          0.31072001,
          -0.36822068,
          -1.04716137,
          -1.72610206,
          -2.40504274,
          -3.08398343,